Search_Key,Offer_Title,Start_Date,End_Date,Club_List_1,Club_List_2,Club_List_3,Club_List_4,Details_1,Details_2,Details_3,Details_4,Details_5,Details_6,Details_7,Details_8,Details_9,Details_10,Details_11,Details_12,Details_13,Details_14,Details_15,Details_16,Details_17,Details_18,Details_19,Details_20,Details_21,Details_22,Details_23,Details_24,Details_25,Details_26,Details_27,Details_28,Details_29,Details_30,Details_31,Details_32,Details_33,Details_34,Details_35,Details_36,Details_37,Details_38,Details_39,Details_40,Details_41,Details_42,Details_43,Details_44,Details_45,Details_46,Details_47,Details_48,Details_49,Details_50,Details_51,Details_52,Details_53,Details_54,Details_55,Details_56,Details_57,Details_58,Details_59,Details_60
memberPromo,"""GroupRaise Donation Acquisition Offer Test""","""7/27/21""","""1/31/22""","""4041;4109;4702;4703;4704;4707;4709;4710;4711;4712;4713;4718;4720;4721;4722;4724;4728;4729;4730;4731;4732;4735;4736;4738;4739;4740;4741;4742;4743;4745;4749;4750;4755;4761;4763;4764;4767;4768;4769;4770;4771;4772;4774;4775;4776;4777;4778;4780;4781;4782;4783;4784;4785;4786;4787;4789;4790;4791;4794;4795;4797;4798;4799;4801;4802;4804;4805;4808;4815;4816;4817;4818;4819;4820;4822;4824;4825;4828;4829;4830;4831;4836;4837;4839;4840;4843;4846;4847;4850;4851;4852;4853;4855;4857;4859;4860;4861;4870;4871;4872;4873;4874;4875;4876;4878;4879;4901;4905;4906;4908;4911;4914;4915;4917;4920;4925;4926;4930;4933;4936;4938;4939;4942;4944;4946;4947;4948;4950;4952;4955;4958;4961;4962;4963;4969;4972;4973;4974;4982;4983;4985;4987;4989;4990;4991;4992;4994;4996;4998;4999;6181;6188;6189;6201;6202;6203;6204;6205;6212;6213;""","""6216;6217;6218;6219;6220;6228;6235;6236;6238;6239;6240;6242;6244;6245;6246;6247;6249;6251;6252;6254;6255;6256;6257;6259;6260;6261;6262;6265;6267;6269;6275;6302;6304;6305;6307;6308;6309;6310;6311;6312;6313;6314;6315;6317;6319;6320;6321;6322;6324;6325;6326;6327;6328;6329;6330;6331;6332;6333;6334;6335;6336;6338;6339;6341;6342;6343;6344;6345;6347;6348;6349;6350;6351;6352;6353;6354;6355;6356;6357;6358;6359;6360;6361;6363;6364;6365;6366;6367;6368;6369;6371;6372;6373;6375;6376;6377;6378;6379;6380;6381;6382;6383;6384;6385;6386;6387;6388;6401;6402;6403;6404;6405;6406;6407;6408;6409;6410;6412;6413;6414;6415;6417;6418;6419;6420;6421;6422;6423;6424;6425;6426;6427;6428;6429;6430;6431;6432;6433;6434;6435;6436;6437;6439;6440;6441;6443;6444;6445;6448;6449;6450;6452;6453;6454;6455;6456;6457;6458;6460;6461;""","""6462;6463;6464;6471;6472;6474;6479;6482;6485;6487;6489;6501;6502;6503;6505;6506;6507;6509;6510;6512;6514;6517;6518;6520;6521;6524;6527;6528;6533;6535;6536;6539;6540;6547;6549;6556;6562;6565;6567;6568;6569;6570;6571;6572;6573;6575;6581;6582;6604;6605;6606;6608;6609;6610;6612;6613;6614;6615;6616;6617;6619;6620;6621;6622;6624;6626;6628;6630;6631;6632;6633;6634;6635;6636;6637;6643;6644;6646;6650;6651;6652;6653;6655;6657;6658;6659;6660;6661;6662;6663;6664;6666;6667;6670;6671;6672;6673;6674;6675;6676;6677;6678;6679;6682;6683;6684;6685;6686;6692;6693;6779;6781;6867;6976;6979;7189;7191;7658;7676;8102;8104;8106;8107;8111;8112;8114;8115;8116;8117;8119;8120;8123;8125;8126;8128;8129;8130;8132;8133;8134;8135;8136;8138;8139;8141;8142;8144;8145;8146;8147;8149;8150;8151;8152;8153;8155;8156;8157;8158;8160;""","""8161;8162;8163;8164;8165;8166;8167;8168;8169;8172;8173;8174;8175;8176;8177;8180;8181;8182;8183;8184;8185;8186;8188;8189;8190;8191;8192;8193;8194;8196;8197;8201;8202;8203;8205;8207;8208;8209;8210;8211;8213;8215;8218;8219;8220;8221;8222;8223;8224;8225;8226;8227;8228;8236;8237;8238;8239;8241;8242;8243;8244;8245;8246;8247;8248;8250;8251;8252;8253;8254;8256;8257;8259;8261;8262;8263;8264;8265;8266;8267;8268;8269;8270;8271;8272;8273;8274;8275;8276;8277;8278;8279;8280;8281;8282;8283;8284;8285;8286;8287;8288;8289;8290;8291;8292;8293;8294;8295;8296;8297;8298;8299""","""off___0___We are partnering with Groupraise to provide a Sam&#39;s Club offer for new signups to fundraising organizations. ""","""off___1___These potential members can participate by purchasing a membership via the organization&#39;s Offer Promotion Page with GroupRaise and will receive a unique promotional voucher code to redeem their membership from Sam&#39;s Club.""","""off___2___Each Organizer&#39;s campaign is only valid for 30 days following the organizer&#39;s enrollment date""","""off___3___Organizers will be able to share the of the following offer for 30 days:""","""off___3___sub___0___Supporter pays the $45 membership fee; 33% of funds goes to the non-profit they received the offer. <em>(See Offer Example Screenshot below)</em><ul><li>Redemption Link: <a href=\""https://www.samsclub.com/join/club?campaignCode=12467&campaignType=SOCIAL\"">https://www.samsclub.com/join/club?campaignCode=12467&campaignType=SOCIAL</a></li><li><img src=\""/content/dam/sams-wire/membership/images/groupraiseoffer-001.png\"" style=\""max-width:100%\"" /></li></ul>""","""val___0___THIS OFFER IS BY INVITATION ONLY""","""val___1___Non-members and Sam&#39;s Club members whose memberships have been expired for at least six months.""","""add___0___Online redemption:""","""add___0___sub___0___Recipient can activate their membership through the following steps:<ul><li>	Visit the redemption link provided by GroupRaise</li><li>Use your promotion code to activate your membership.</li><li>Pick up your membership card at your local Sam&#39;s Club.</li></ul>""","""add___1___GroupRaise will facilitate the donation of a portion of the membership cost to the campaign organizer. Sam&#39;s Club is not donating to the campaign organizer or organization and has no responsibility for the use by the campaign organizer or organization of the funds from the donation. No portion of the membership cost is tax deductible for charitable donation.""",,,,,,,,,,,,,,,,,,,,,,,,,,,,,,,,,,,,,,,,,,,,,,,,,,
memberPromo,"""Pampers Campaign""","""8/2/21""","""8/22/21""","""4041;4109;4702;4703;4704;4707;4709;4710;4711;4712;4713;4718;4720;4721;4722;4724;4728;4729;4730;4731;4732;4735;4736;4738;4739;4740;4741;4742;4743;4745;4749;4750;4755;4761;4763;4764;4767;4768;4769;4770;4771;4772;4774;4775;4776;4777;4778;4780;4781;4782;4783;4784;4785;4786;4787;4789;4790;4791;4794;4795;4797;4798;4799;4801;4802;4804;4805;4808;4815;4816;4817;4818;4819;4820;4822;4824;4825;4828;4829;4830;4831;4836;4837;4839;4840;4843;4846;4847;4850;4851;4852;4853;4855;4857;4859;4860;4861;4870;4871;4872;4873;4874;4875;4876;4878;4879;4901;4905;4906;4908;4911;4914;4915;4917;4920;4925;4926;4930;4933;4936;4938;4939;4942;4944;4946;4947;4948;4950;4952;4955;4958;4961;4962;4963;4969;4972;4973;4974;4982;4983;4985;4987;4989;4990;4991;4992;4994;4996;4998;4999;6181;6188;6189;6201;6202;6203;6204;6205;6212;6213;""","""6216;6217;6218;6219;6220;6228;6235;6236;6238;6239;6240;6242;6244;6245;6246;6247;6249;6251;6252;6254;6255;6256;6257;6259;6260;6261;6262;6265;6267;6269;6275;6302;6304;6305;6307;6308;6309;6310;6311;6312;6313;6314;6315;6317;6319;6320;6321;6322;6324;6325;6326;6327;6328;6329;6330;6331;6332;6333;6334;6335;6336;6338;6339;6341;6342;6343;6344;6345;6347;6348;6349;6350;6351;6352;6353;6354;6355;6356;6357;6358;6359;6360;6361;6363;6364;6365;6366;6367;6368;6369;6371;6372;6373;6375;6376;6377;6378;6379;6380;6381;6382;6383;6384;6385;6386;6387;6388;6401;6402;6403;6404;6405;6406;6407;6408;6409;6410;6412;6413;6414;6415;6417;6418;6419;6420;6421;6422;6423;6424;6425;6426;6427;6428;6429;6430;6431;6432;6433;6434;6435;6436;6437;6439;6440;6441;6443;6444;6445;6448;6449;6450;6452;6453;6454;6455;6456;6457;6458;6460;6461;""","""6462;6463;6464;6471;6472;6474;6479;6482;6485;6487;6489;6501;6502;6503;6505;6506;6507;6509;6510;6512;6514;6517;6518;6520;6521;6524;6527;6528;6533;6535;6536;6539;6540;6547;6549;6556;6562;6565;6567;6568;6569;6570;6571;6572;6573;6575;6581;6582;6604;6605;6606;6608;6609;6610;6612;6613;6614;6615;6616;6617;6619;6620;6621;6622;6624;6626;6628;6630;6631;6632;6633;6634;6635;6636;6637;6643;6644;6646;6650;6651;6652;6653;6655;6657;6658;6659;6660;6661;6662;6663;6664;6666;6667;6670;6671;6672;6673;6674;6675;6676;6677;6678;6679;6682;6683;6684;6685;6686;6692;6693;6779;6781;6867;6976;6979;7189;7191;7658;7676;8102;8104;8106;8107;8111;8112;8114;8115;8116;8117;8119;8120;8123;8125;8126;8128;8129;8130;8132;8133;8134;8135;8136;8138;8139;8141;8142;8144;8145;8146;8147;8149;8150;8151;8152;8153;8155;8156;8157;8158;8160;""","""8161;8162;8163;8164;8165;8166;8167;8168;8169;8172;8173;8174;8175;8176;8177;8180;8181;8182;8183;8184;8185;8186;8188;8189;8190;8191;8192;8193;8194;8196;8197;8201;8202;8203;8205;8207;8208;8209;8210;8211;8213;8215;8218;8219;8220;8221;8222;8223;8224;8225;8226;8227;8228;8236;8237;8238;8239;8241;8242;8243;8244;8245;8246;8247;8248;8250;8251;8252;8253;8254;8256;8257;8259;8261;8262;8263;8264;8265;8266;8267;8268;8269;8270;8271;8272;8273;8274;8275;8276;8277;8278;8279;8280;8281;8282;8283;8284;8285;8286;8287;8288;8289;8290;8291;8292;8293;8294;8295;8296;8297;8298;8299""","""off___0___2MM+ consumers will receive a dedicated Pampers email with a unique voucher code to sign up for a free 90-day trial membership offer with autorenewal ""","""off___1___Trial members will see a promotion for $10 off any 2 Pampers diapers on Instacart Sam&#39;s club storefront and enter the promo code to receive the $10 discount ""","""val___0___Only those who receive the email will be able to redeem the 90-day trial membership offer with the unique voucher code enclosed in the email.""","""val___1___Recipient must not have been a member within the last 6 months to redeem the 90-day Club membership.""","""val___1___sub___0___To activate online: the link to redeem online will be in the email.  See it <a href=\""https://www.samsclub.com/join/club?campaignCode=12556&couponID=SOCIAL-12556&campaignType=SOCIAL\"">here</a>""","""val___1___sub___1___To activate in-club:<ul><li>create a new Sam&#39;s Club membership using activation code 12556</li><li>when prompted enter unique promotional voucher code supplied by prospective member</li><li>sign up new member and issue Club membership card</li><li>Membership should automatically ring up paid for $0.00</li></ul>""","""val___2___No credit card is required to sign up for the free 90-day Club membership however&#44; the membership will renew for one year automatically at the end of the trial offer period with any credit card on file digitally.""","""val___3___90-day free membership trial with autorenewal Terms & Conditions: <a href=\""https://www.samsclub.com/content/terms-and-conditions#90-day-free-trial\"">here</a>""","""val___4___If members have trouble redeeming the code&#44; refer them to the live chat feature online: (<a href=\""https://help.samsclub.com/app/chat/chat-launch\"">https://help.samsclub.com/app/chat/chat-launch</a>)""","""add___0___Example email:""","""add___0___sub___0___<img src=\""/content/dam/sams-wire/membership/images/pampersclubemailoffer-001.png\"" style=\""max-width:100%\"" />""","""add___1___Example banner:""","""add___1___sub___0___<img src=\""/content/dam/sams-wire/membership/images/pampersofferbanner-001.png\"" style=\""max-width:100%\"" />""",,,,,,,,,,,,,,,,,,,,,,,,,,,,,,,,,,,,,,,,,,,,,,,
memberPromo,"""Military Offer""","""8/4/21""","""1/31/22""",,,,,"""off___0___Qualified active and former military personnel who join or renew their Sam&#39;s Club membership in-club or in the field will receive an offer for $10 off next merchandise purchase of qualifying items.  This replaces the previous gift card offer.""","""val___0___This offer is valid for active and retired military&#44; veterans and their spouses.""","""val___1___This offer is for both new and renewing Military members.""","""val___2___This offer can be used for in-club and Sold in Field memberships.""","""val___3___Members who are joining or renewing must show a valid United States military identification to receive this offer. Following are document examples to prove United States military service:<ul><li>o	Active military ID&#44; issued by the Department of Defense</li><li>Retired military ID&#44; issued by the Department of Defense</li><li>	Copy of DD-214&#44; along with valid photo ID</li><li>Veterans Identification Card (VIC)</li><li>Membership card from military service organization (i.e.  American Legion&#44; VFW&#44; DAV)&#44; along with valid photo ID</li><li>Common Access Card (CAC)</li><li>Veterans Administration (VA) medical benefits card</li></ul>""","""add___0___Verify the member qualifies for the military offer based on examples above.""","""add___1___Use activation codes:<ul><li>12535:   New Military $10 basket</li><li>12536:   Renew Military $10 basket (must be entered in express prior to renewal at POS)</li></ul>""","""add___2___Tell member about how the offer works<ul><li>offer must be redeemed in one single transaction on a register in club (not Scan & Go&#44; Club Pickup or Direct to Home).</li><li>Some items do not qualify such as milk&#44; alcohol&#44; gift cards&#44; etc.</li><li>Instant Savings will be visible at bottom of receipt when redeemed.</li></ul>""",,,,,,,,,,,,,,,,,,,,,,,,,,,,,,,,,,,,,,,,,,,,,,,,,,,,
memberPromo,"""GroupRaise Donation Acquisition Offer Test (25% Donation)""","""7/27/21""","""1/31/22""","""4041;4109;4702;4703;4704;4707;4709;4710;4711;4712;4713;4718;4720;4721;4722;4724;4728;4729;4730;4731;4732;4735;4736;4738;4739;4740;4741;4742;4743;4745;4749;4750;4755;4761;4763;4764;4767;4768;4769;4770;4771;4772;4774;4775;4776;4777;4778;4780;4781;4782;4783;4784;4785;4786;4787;4789;4790;4791;4794;4795;4797;4798;4799;4801;4802;4804;4805;4808;4815;4816;4817;4818;4819;4820;4822;4824;4825;4828;4829;4830;4831;4836;4837;4839;4840;4843;4846;4847;4850;4851;4852;4853;4855;4857;4859;4860;4861;4870;4871;4872;4873;4874;4875;4876;4878;4879;4901;4905;4906;4908;4911;4914;4915;4917;4920;4925;4926;4930;4933;4936;4938;4939;4942;4944;4946;4947;4948;4950;4952;4955;4958;4961;4962;4963;4969;4972;4973;4974;4982;4983;4985;4987;4989;4990;4991;4992;4994;4996;4998;4999;6181;6188;6189;6201;6202;6203;6204;6205;6212;6213;""","""6216;6217;6218;6219;6220;6228;6235;6236;6238;6239;6240;6242;6244;6245;6246;6247;6249;6251;6252;6254;6255;6256;6257;6259;6260;6261;6262;6265;6267;6269;6275;6302;6304;6305;6307;6308;6309;6310;6311;6312;6313;6314;6315;6317;6319;6320;6321;6322;6324;6325;6326;6327;6328;6329;6330;6331;6332;6333;6334;6335;6336;6338;6339;6341;6342;6343;6344;6345;6347;6348;6349;6350;6351;6352;6353;6354;6355;6356;6357;6358;6359;6360;6361;6363;6364;6365;6366;6367;6368;6369;6371;6372;6373;6375;6376;6377;6378;6379;6380;6381;6382;6383;6384;6385;6386;6387;6388;6401;6402;6403;6404;6405;6406;6407;6408;6409;6410;6412;6413;6414;6415;6417;6418;6419;6420;6421;6422;6423;6424;6425;6426;6427;6428;6429;6430;6431;6432;6433;6434;6435;6436;6437;6439;6440;6441;6443;6444;6445;6448;6449;6450;6452;6453;6454;6455;6456;6457;6458;6460;6461;""","""6462;6463;6464;6471;6472;6474;6479;6482;6485;6487;6489;6501;6502;6503;6505;6506;6507;6509;6510;6512;6514;6517;6518;6520;6521;6524;6527;6528;6533;6535;6536;6539;6540;6547;6549;6556;6562;6565;6567;6568;6569;6570;6571;6572;6573;6575;6581;6582;6604;6605;6606;6608;6609;6610;6612;6613;6614;6615;6616;6617;6619;6620;6621;6622;6624;6626;6628;6630;6631;6632;6633;6634;6635;6636;6637;6643;6644;6646;6650;6651;6652;6653;6655;6657;6658;6659;6660;6661;6662;6663;6664;6666;6667;6670;6671;6672;6673;6674;6675;6676;6677;6678;6679;6682;6683;6684;6685;6686;6692;6693;6779;6781;6867;6976;6979;7189;7191;7658;7676;8102;8104;8106;8107;8111;8112;8114;8115;8116;8117;8119;8120;8123;8125;8126;8128;8129;8130;8132;8133;8134;8135;8136;8138;8139;8141;8142;8144;8145;8146;8147;8149;8150;8151;8152;8153;8155;8156;8157;8158;8160;""","""8161;8162;8163;8164;8165;8166;8167;8168;8169;8172;8173;8174;8175;8176;8177;8180;8181;8182;8183;8184;8185;8186;8188;8189;8190;8191;8192;8193;8194;8196;8197;8201;8202;8203;8205;8207;8208;8209;8210;8211;8213;8215;8218;8219;8220;8221;8222;8223;8224;8225;8226;8227;8228;8236;8237;8238;8239;8241;8242;8243;8244;8245;8246;8247;8248;8250;8251;8252;8253;8254;8256;8257;8259;8261;8262;8263;8264;8265;8266;8267;8268;8269;8270;8271;8272;8273;8274;8275;8276;8277;8278;8279;8280;8281;8282;8283;8284;8285;8286;8287;8288;8289;8290;8291;8292;8293;8294;8295;8296;8297;8298;8299""","""off___0___We are partnering with GroupRaise to provide a Sam&#39;s Club offer for new signups to fundraising organizations.""","""off___1___These potential members can participate by purchasing a membership via the organization&#39;s Offer Promotion Page with GroupRaise and will receive a unique promotional voucher code to redeem their membership from Sam&#39;s Club. ""","""off___2___Each Organizer&#39;s campaign is only valid for 30 days following the organizer&#39;s enrollment date.""","""off___3___Organizers will be able to share the following offers for 30 days:<ul><li>Supporter pays the $45 membership fee; 25% of funds goes to the non-profit they received the offer from AND a free Take N Bake Pizza* or Seasoned Rotisserie Chicken*.<ul><li>Redemption Link: <a href=\""https://www.samsclub.com/join/club?campaignCode=12485&campaignType=SOCIAL\"">https://www.samsclub.com/join/club?campaignCode=12485&campaignType=SOCIAL</a></li></ul></li><li>See 25% Offer Example Screenshot below<ul><li><img src=\""/content/dam/sams-wire/membership/currentpromotions/2021/group-raise-25per-examp-001.png\"" style=\""max-width:100%\"" /></li></ul></li></ul>""","""val___0___THIS OFFER IS BY INVITATION ONLY""","""val___1___Non-members and Sam&#39;s Club members whose memberships have been expired for at least six months""","""add___0___Online redemption:<ul><li>Recipient can activate their membership through the following steps:<ol><li>Visit the redemption link provided by GroupRaise.</li><li>Use your promotion code to activate your membership.</li><li>Pick up your membership card at your local Sam&#39;s Club.</li></ol></li></ul>""","""add___1___New members have up to 30 days from membership purchase to claim complimentary food item.""","""add___2___GroupRaise will facilitate the donation of a portion of the membership cost to the campaign organizer. Sam&#39;s Club is not donating to the campaign organizer or organization and has no responsibility for the use by the campaign organizer or organization of the funds from the donation. No portion of the membership cost is tax deductible for charitable donation.""",,,,,,,,,,,,,,,,,,,,,,,,,,,,,,,,,,,,,,,,,,,,,,,,,,,
memberPromo,"""American Express One-Time Statement Credit of $25 for new Sam's Club Membership""","""8/23/21""","""3/31/22""","""4041;4109;4702;4703;4704;4707;4709;4710;4711;4712;4713;4718;4720;4721;4722;4724;4728;4729;4730;4731;4732;4735;4736;4738;4739;4740;4741;4742;4743;4745;4749;4750;4755;4761;4763;4764;4767;4768;4769;4770;4771;4772;4774;4775;4776;4777;4778;4780;4781;4782;4783;4784;4785;4786;4787;4789;4790;4791;4794;4795;4797;4798;4799;4801;4802;4804;4805;4808;4815;4816;4817;4818;4819;4820;4822;4824;4825;4828;4829;4830;4831;4836;4837;4839;4840;4843;4846;4847;4850;4851;4852;4853;4855;4857;4859;4860;4861;4870;4871;4872;4873;4874;4875;4876;4878;4879;4901;4905;4906;4908;4911;4914;4915;4917;4920;4925;4926;4930;4933;4936;4938;4939;4942;4944;4946;4947;4948;4950;4952;4955;4958;4961;4962;4963;4969;4972;4973;4974;4982;4983;4985;4987;4989;4990;4991;4992;4994;4996;4998;4999;6181;6188;6189;6201;6202;6203;6204;6205;6212;6213;""","""6216;6217;6218;6219;6220;6228;6235;6236;6238;6239;6240;6242;6244;6245;6246;6247;6249;6251;6252;6254;6255;6256;6257;6259;6260;6261;6262;6265;6267;6269;6275;6302;6304;6305;6307;6308;6309;6310;6311;6312;6313;6314;6315;6317;6319;6320;6321;6322;6324;6325;6326;6327;6328;6329;6330;6331;6332;6333;6334;6335;6336;6338;6339;6341;6342;6343;6344;6345;6347;6348;6349;6350;6351;6352;6353;6354;6355;6356;6357;6358;6359;6360;6361;6363;6364;6365;6366;6367;6368;6369;6371;6372;6373;6375;6376;6377;6378;6379;6380;6381;6382;6383;6384;6385;6386;6387;6388;6401;6402;6403;6404;6405;6406;6407;6408;6409;6410;6412;6413;6414;6415;6417;6418;6419;6420;6421;6422;6423;6424;6425;6426;6427;6428;6429;6430;6431;6432;6433;6434;6435;6436;6437;6439;6440;6441;6443;6444;6445;6448;6449;6450;6452;6453;6454;6455;6456;6457;6458;6460;6461;""","""6462;6463;6464;6471;6472;6474;6479;6482;6485;6487;6489;6501;6502;6503;6505;6506;6507;6509;6510;6512;6514;6517;6518;6520;6521;6524;6527;6528;6533;6535;6536;6539;6540;6547;6549;6556;6562;6565;6567;6568;6569;6570;6571;6572;6573;6575;6581;6582;6604;6605;6606;6608;6609;6610;6612;6613;6614;6615;6616;6617;6619;6620;6621;6622;6624;6626;6628;6630;6631;6632;6633;6634;6635;6636;6637;6643;6644;6646;6650;6651;6652;6653;6655;6657;6658;6659;6660;6661;6662;6663;6664;6666;6667;6670;6671;6672;6673;6674;6675;6676;6677;6678;6679;6682;6683;6684;6685;6686;6692;6693;6779;6781;6867;6976;6979;7189;7191;7658;7676;8102;8104;8106;8107;8111;8112;8114;8115;8116;8117;8119;8120;8123;8125;8126;8128;8129;8130;8132;8133;8134;8135;8136;8138;8139;8141;8142;8144;8145;8146;8147;8149;8150;8151;8152;8153;8155;8156;8157;8158;8160;""","""8161;8162;8163;8164;8165;8166;8167;8168;8169;8172;8173;8174;8175;8176;8177;8180;8181;8182;8183;8184;8185;8186;8188;8189;8190;8191;8192;8193;8194;8196;8197;8201;8202;8203;8205;8207;8208;8209;8210;8211;8213;8215;8218;8219;8220;8221;8222;8223;8224;8225;8226;8227;8228;8236;8237;8238;8239;8241;8242;8243;8244;8245;8246;8247;8248;8250;8251;8252;8253;8254;8256;8257;8259;8261;8262;8263;8264;8265;8266;8267;8268;8269;8270;8271;8272;8273;8274;8275;8276;8277;8278;8279;8280;8281;8282;8283;8284;8285;8286;8287;8288;8289;8290;8291;8292;8293;8294;8295;8296;8297;8298;8299""","""off___0___American Express cardholders who join as a new Sam&#39;s Club member for $45&#44; online or in-club&#44; will get a one-time $25 statement credit from American Express.""","""val___0___New club members joining online or in-club""","""val___0___sub___0___This offer excludes Plus level memberships&#44; membership renewals&#44; upgrades&#44; add-ons or additional membership or any purchase of Sam&#39;s Club Gift of Membership&#44; Prepaid Sam&#39;s Savings Membership&#44; or anyone who has been a member within the last six months.""","""add___0___It may take up to 90 days for the statement credit to apply to their American Express account.""","""add___1___Be aware of the offer and answer member questions if necessary.""","""add___2___Offer may not be combined with any other Sam&#39;s Club offer or promotion.""",,,,,,,,,,,,,,,,,,,,,,,,,,,,,,,,,,,,,,,,,,,,,,,,,,,,,,
memberPromo,"""Affiliate Partner Programs""","""7/15/21""","""1/31/22""",,,,,"""off___0___Join for $45 and get a free $45 eGift card:""","""off___0___sub___0___Join now for $45 and get a free $45 eGift card via email""","""off___0___sub___1___Prospective member must show offer via printout or smartphone of this offer to join in-club.""","""off___0___sub___2___Associates should not offer this incentive unsolicited to new members joining.""","""off___0___sub___3___Member can join either online using the link provided in the ad or bring the offer to the membership desk in club.""","""off___0___sub___4___Offer is a targeted eGift card that will be sent via email to the email address used for membership creation. Allow up to 4 weeks for delivery.""","""off___0___sub___5___FOLLOW INSTRUCTIONS UNDER ADDITIONAL DETAILS BELOW TO SIGN UP NEW MEMBERS.""","""val___0___Offer is only good for new signups (not renewals).""","""add___0___Below is a list of the Affiliate partners that may be advertising this Sam&apos;s Club offer:<ul><li>BeFrugal</li><li>BradsDeals</li><li>Dealnews</li><li>Dealsplus</li><li>Ebates</li><li>FlexOffers</li><li>Groupon</li><li>Hip2Save</li><li>Krazy Coupon Lady</li><li>Mint</li><li>Next Jump</li><li>Offers.com</li><li>Queen Bee Coupons</li><li>Retail Me Not</li><li>Savings.com</li><li>Slickdeals</li><li>TopCashBack</li></ul>""","""add___1___Online Sign-up:""","""add___1___sub___0___Member must join online via the link in the ad""","""add___1___sub___1___eGift Card will be sent to email address used for membership creation within 30 days.""","""add___1___sub___2___In Club Sign-up:<ul><li>Create a new Club membership and enter activation code 12596.<ul><li>Note: Some members may present 12569&#44; which is an older code for the same program.  Please use 12596 for membership creation.</li></ul></li><li>Valid email address is required to fulfill the incentive.</li><li>Finalize new Club Membership and process $45.00 payment.</li><li>eGift card will arrive to email address provided at signup within 4 weeks.  Club should not issue a physical gift card.</li></ul>""",,,,,,,,,,,,,,,,,,,,,,,,,,,,,,,,,,,,,,,,,,,,,,,
