Search_Key,Offer_Title,Start_Date,End_Date,Club_List_1,Club_List_2,Club_List_3,Club_List_4,Details_1,Details_2,Details_3,Details_4,Details_5,Details_6,Details_7,Details_8,Details_9,Details_10,Details_11,Details_12,Details_13,Details_14,Details_15,Details_16,Details_17,Details_18,Details_19,Details_20,Details_21,Details_22,Details_23,Details_24,Details_25,Details_26,Details_27,Details_28,Details_29,Details_30,Details_31,Details_32,Details_33,Details_34,Details_35,Details_36,Details_37,Details_38,Details_39,Details_40,Details_41,Details_42,Details_43,Details_44,Details_45,Details_46,Details_47,Details_48,Details_49,Details_50,Details_51,Details_52,Details_53,Details_54,Details_55,Details_56,Details_57,Details_58,Details_59,Details_60
memberPromo,"""Costco Incursion In-Club Offer""","""4/14/21""","""5/31/21""","""8104;8266;4749""",,,,"""off___0___Join now for $45 and get a free $45 gift card at the membership desk at your local Sam&#39;s Club""","""off___1___Prospective member must bring Mailer or Door hanger to the membership desk to get this offer. Associates should not offer this incentive unsolicited to new members joining.""","""off___2___Member can join either online using the vanity URL link or QR code provided in the Direct Mail or Door hanger or bring the offer to the membership desk in club.""","""off___3___Members who join online must still redeem the actual gift card at the membership desk in the club.""","""off___4___Offer is an Instant Savings on a $45 gift card. This offer works differently than a traditional gift card. FOLLOW INSTRUCTIONS UNDER ADDITIONAL DETAILS BELOW.""","""val___0___NEW members only (not valid for existing membership renewals).""","""add___0___Online Sign-up:""","""add___0___sub___0___Member must join online using the vanity URL link or QR code on the mailer or door hanger to load the Instant Savings to the new membership.""","""add___0___sub___1___On a register&#44; swipe the new membership card and enter item #980299084<ul><li>If you receive a message stating&#44; Remind the member this gift card can only be used for membership&#44; please click OK and ignore the message.</li><li>The $45 Instant Savings will be applied when totaled so member pays $0.00 and balance on the gift card will be $45.</li></ul>""","""add___1___In Club Sign-up:""","""add___1___sub___0___Create a new Club membership and enter activation code listed in the marketing to load Instant Savings to member&#39;s card.<ul><li>Direct mail:  activation code 12505</li><li>Door Hanger:  activation code 12511</li></ul>""","""add___1___sub___1___Process transaction for a new $45.00 membership and take payment.""","""add___1___sub___2___In a second separate transaction&#44; scan member&#39;s new card and enter gift card #980299084 ""","""add___1___sub___3___If you receive a message stating&#44; Remind the member this gift card can only be used for membership&#44; please click OK and ignore the message""","""add___1___sub___4___The $45 Instant Savings will be applied when totaled so member pays $0.00 and balance on gift card will be $45.""",,,,,,,,,,,,,,,,,,,,,,,,,,,,,,,,,,,,,,,,,,,,,
memberPromo,"""Weight Watcher Wellness Wins Rewards""","""3/26/21""","""1/31/22""","""6425;6430;4860;4936;6373;6457;8189;4840;6321;6324;6331;6436;6535;8149;8164;8167;8185;4710;4711;4729;4996;6343;6351;6354;6365;6368;6371;6458;6518;6524;6569;8220;4718;4730;4786;6682;6683;6684;6685;6686;4702;4712;4713;4720;4721;4742;4743;4763;4764;4769;4783;4795;4843;4850;4905;4906;4911;4914;4925;4939;4948;4958;6188;6202;6244;6245;6246;6255;6259;6262;6265;6269;6336;6338;6350;6367;6372;6376;6381;6421;6422;6439;6453;6471;6482;6502;6781;6867;7676;8126;8153;8156;8190;8210;8224;8226;8227;8242;8244;8245;8246;8248;8250;8259;8262;8264;8267;8268;8269;8270;8274;8275;8277;8279;8280;8281;8282;8284;8286;8288;8295;8299;4930;6249;6256;6260;6501;6507;6512;6572;8112;8222;8256;8257;8292;8294;6565;8165;4872;4879;4901;6203;6236;6353;6463;6571;6582;8142;8252;8278;8283;4847;4855;4859;4952;4994;6251;6332;6460;6533;""","""6536;6547;6567;6575;6581;6675;6676;6677;6678;6679;6693;8160;8161;8175;8191;4731;4761;4839;6238;6267;6342;6779;7189;8117;8239;8241;8263;8289;4750;4846;4947;4962;4963;6242;6302;6305;6307;6308;6314;6317;6322;6326;6327;6375;6380;6404;6407;6450;6517;6528;6556;8132;8136;8139;8152;6201;6356;6366;6406;6423;6428;6431;6440;6456;6539;6673;6674;4768;4974;4983;6257;6261;6382;8177;4703;4784;4938;4961;6347;6408;6672;4041;4722;4774;6369;6670;6671;8144;8145;6352;6386;4873;6181;6413;6461;8146;4933;6385;8172;4797;4798;4831;4917;4946;4950;6216;6348;6355;6402;6414;6443;6452;6540;6570;6573;6976;8129;8218;8219;8223;8228;4805;6379;4740;4790;4871;6329;6503;8236;8271;4741;4875;4920;4985;6247;6252;6415;6474;6479;6505;8125;8163;8182;8205;8207;8243;8251;8293;8296;4736;4738;4787;6254;6309;6310;6311;6312;6320;6427;6510;""","""8183;4778;4781;4944;4982;6319;6359;6412;6417;6419;6429;6454;6562;6657;6658;6659;6660;6661;6662;6663;6664;6666;6667;8291;6333;6462;8186;4771;6239;6357;6383;6434;6650;6651;6652;6653;6655;8193;4109;4775;4837;4874;6220;6521;6527;8114;8181;8221;8237;8261;8265;8273;4728;4876;4908;4992;6449;8111;8133;8188;8276;4707;4791;4870;6275;6418;6426;8176;8208;8254;4851;4926;6304;6313;6315;6325;6424;6437;8123;8135;8168;8169;8174;4815;4878;4942;4999;6228;6328;6334;6339;6349;6358;6384;6388;6444;6464;6485;6487;6489;8128;8180;8184;8197;8215;8285;8297;8298;6345;4973;6344;6432;6472;6514;6568;6979;8162;8238;4755;6410;4739;4780;4789;4802;4804;4820;6204;6409;6506;6509;6643;6644;6646;7658;8115;8158;8166;8194;8202;8203;8211;8213;8225;8287;4772;4782;4785;4794;4801;4818;4828;4852;4857;4861;4972;4991;4998;6189;6212;6217;""","""6218;6335;6341;6361;6363;6364;6387;6401;6403;6420;6441;6445;6448;6520;6637;7191;8116;8119;8120;8130;8138;8141;8150;8151;8155;8157;8173;8201;8253;8290;6330;6636;4745;4770;4777;4816;4853;4987;6219;6360;6549;6630;6631;6632;6633;6634;6635;8147;8272;4704;4709;4735;4767;4799;4819;4822;4824;6235;6240;6378;6405;6433;6455;6609;6610;6612;6613;6614;6615;6616;6617;6619;6620;6621;6622;6624;6626;6628;4732;4829;4830;4915;4955;6205;6213;6604;6605;6606;6608;6692;4749;4808;4825;4969;6377;8104;8134;8209;8266;4724;4776;4817;4836;4989;4990;6435;8102;8106;8107;8192;8196;8247""","""off___0___Earn a Sam&#39;s Club 90-Day Membership Trial  through Weight Watchers Wellness Wins Rewards Program.""","""val___0___Only those who receive the email from Weight Watcher&#39;s will be able to redeem this offer with the unique voucher code enclosed in the email""","""add___0___Recipient can activate the free 90-day Club membership either online or in club with a unique voucher code.""","""add___0___sub___0___To activate online: the link to redeem online will be included in the email.""","""add___0___sub___1___To activate in club:<ul><li>Create a new Sam&#39;s Club membership using activation code 12414.</li><li>When prompted enter unique voucher code supplied by recipient</li><li>Sign up member and issue Club membership card</li><li>Membership should automatically ring up paid for $0.00</li></ul>""","""add___1___Member will be prompted to renew for 12 months at the end of the 90-day free trial period.""","""add___2___Member will be automatically opted-in for auto renew but can choose to opt-out after the membership is set up.""","""add___3___No substitutions or rain checks. No cash value. Limit of one free 90-day membership per email. ""","""add___4___If members have trouble redeeming the code in-club&#44; refer them to the live chat feature (<a href=\""https://help.samsclub.com/app/chat/chat_launch\"" target=\""_blank\"">https://help.samsclub.com/app/chat/chat_launch</a>)""",,,,,,,,,,,,,,,,,,,,,,,,,,,,,,,,,,,,,,,,,,,,,,,,,,,
memberPromo,"""Little Rock Clubs - Winback Program""","""4/14/21""","""6/26/21""","""8104;8266;4749""",,,,"""off___0___This is a campaign going to members who are 12 months or more lapsed in membership. Offer is valid through 6/26/21. Associate instructions are on the mailer.""","""val___0___Member must present original offer (no copies) and renew their membership to receive the offer.""","""add___0___$25 gift card. ""","""add___0___sub___0___Offer example:<ul><li><img src=\""/content/dam/sams-wire/membership/images/lr-win-bak-camp-off-001.png\"" style=\""max-width:100%\"" /></li></ul>""","""add___0___sub___1___Associate instructions for gift card:<ol><li>Scratch to reveal membership number.</li><li>Renew membership.</li><li>Key in item 980244026 for the $25 gift card.</li><li>Follow remaining prompts to complete transaction.</li><li>Print new membership card</li></ul>""",,,,,,,,,,,,,,,,,,,,,,,,,,,,,,,,,,,,,,,,,,,,,,,,,,,,,,,
memberPromo,"""Q2 Social Acquisition $45 Gift Card""","""5/10/21""","""7/31/21""","""4722;4731;4761;4775;4831;4839;4874;4946;4972;4974;4983;6220;6238;6257;6261;6267;6330;6332;6342;6382;6443;6520;6521;6536;6567;6570;6670;6676;6693;6779;6976;7189;8117;8144;8145;8150;8157;8160;8177;8218;8221;8223;8241;8261;8263;8289""",,,,"""off___0___Join for $45 and get a free $45 eGift card after Scan & Go purchase in first 30 days.  Allow 2-4 weeks for eGift card delivery after first Scan & Go purchase.""","""off___1___Prospective member can join either online or in club.  ""","""off___1___sub___0___Prospective member joining online must use link provided in the email to join or offer will not apply.""","""off___1___sub___1___Prospective member joining in club must bring email to club with activation code 12510 and provide email address when signing up.""","""val___0___NEW members only (not valid for existing membership renewals).""","""add___0___Prospective members joining in club:""","""add___0___sub___0___Member must bring email to club and provide email address when joining to qualify for the offer. ""","""add___0___sub___1___Process $45 Club membership using activation code 12510 to load offer to membership.  Complete membership and take payment. ""","""add___0___sub___2___Explain how to download the Sams Club App and how to use Scan & Go.""","""add___0___sub___3___Remind member they must use Scan & Go within first 30 days to qualify for the $45 eGift Card""","""add___0___sub___4___eGift card will be sent to email address on file within 2-4 weeks after Scan & Go purchase ""","""add___1___Use this opportunity to tell the member about the benefits of Plus and upgrade the member in a separate transaction. """,,,,,,,,,,,,,,,,,,,,,,,,,,,,,,,,,,,,,,,,,,,,,,,,
memberPromo,"""Q2 Social Acquisitions $45 Gift Card""","""4/13/21""","""6/30/21""","""4041;4109;4702;4703;4704;4707;4709;4710;4711;4712;4713;4718;4720;4721;4724;4728;4729;4730;4732;4735;4736;4738;4739;4740;4741;4742;4743;4745;4749;4750;4755;4763;4764;4767;4768;4769;4770;4771;4772;4774;4776;4777;4778;4780;4781;4782;4783;4784;4785;4786;4787;4789;4790;4791;4794;4795;4797;4798;4799;4801;4802;4804;4805;4808;4815;4816;4817;4818;4819;4820;4822;4824;4825;4828;4829;4830;4836;4837;4840;4843;4846;4847;4850;4851;4852;4853;4855;4857;4859;4860;4861;4866;4870;4871;4872;4873;4875;4876;4878;4879;4901;4905;4906;4908;4911;4914;4915;4917;4920;4925;4926;4930;4933;4936;4938;4939;4942;4944;4947;4948;4950;4952;4955;4958;4961;4962;4963;4969;4973;4982;4985;4987;4989;4990;4991;4992;4994;4996;4998;4999;6181;6188;6189;6201;6202;6203;6204;6205;6212;6213;6216;6217;6218;6219;6225;6228;6235;6236;6239;6240;""","""6242;6244;6245;6246;6247;6249;6251;6252;6254;6255;6256;6259;6260;6262;6265;6269;6270;6275;6302;6304;6305;6307;6308;6309;6310;6311;6312;6313;6314;6315;6317;6319;6320;6321;6322;6324;6325;6326;6327;6328;6329;6331;6333;6334;6335;6336;6338;6339;6341;6343;6344;6345;6347;6348;6349;6350;6351;6352;6353;6354;6355;6356;6357;6358;6359;6360;6361;6363;6364;6365;6366;6367;6368;6369;6371;6372;6373;6375;6376;6377;6378;6379;6380;6381;6383;6384;6385;6386;6387;6388;6401;6402;6403;6404;6405;6406;6407;6408;6409;6410;6412;6413;6414;6415;6417;6418;6419;6420;6421;6422;6423;6424;6425;6426;6427;6428;6429;6430;6431;6432;6433;6434;6435;6436;6437;6439;6440;6441;6444;6445;6448;6449;6450;6452;6453;6454;6455;6456;6457;6458;6460;6461;6462;6463;6464;6471;6472;6474;6479;6482;6485;6487;6489;6501;6502;6503;6505;6506;6507;6509;""","""6510;6512;6514;6517;6518;6524;6527;6528;6533;6535;6539;6540;6543;6547;6549;6556;6562;6565;6568;6569;6571;6572;6573;6575;6581;6582;6604;6605;6606;6608;6609;6610;6612;6613;6614;6615;6616;6617;6619;6620;6621;6622;6624;6626;6628;6630;6631;6632;6633;6634;6635;6636;6637;6643;6644;6646;6650;6651;6652;6653;6655;6657;6658;6659;6660;6661;6662;6663;6664;6666;6667;6671;6672;6673;6674;6675;6677;6678;6679;6680;6682;6683;6684;6685;6686;6689;6690;6692;6781;6867;6979;7191;7658;7676;8102;8104;8106;8107;8111;8112;8114;8115;8116;8119;8120;8123;8125;8126;8128;8129;8130;8132;8133;8134;8135;8136;8138;8139;8141;8142;8146;8147;8149;8151;8152;8153;8155;8156;8158;8161;8162;8163;8164;8165;8166;8167;8168;8169;8172;8173;8174;8175;8176;8180;8181;8182;8183;8184;8185;8186;8188;8189;8190;8191;8192;8193;8194;8196;8197;8201;""","""8202;8203;8205;8207;8208;8209;8210;8211;8213;8215;8219;8220;8222;8224;8225;8226;8227;8228;8236;8237;8238;8239;8242;8243;8244;8245;8246;8247;8248;8250;8251;8252;8253;8254;8256;8257;8259;8262;8264;8265;8266;8267;8268;8269;8270;8271;8272;8273;8274;8275;8276;8277;8278;8279;8280;8281;8282;8283;8284;8285;8286;8287;8288;8290;8291;8292;8293;8294;8295;8296;8297;8298;8299""","""off___0___Join now for $45 and get a free $45 gift card at the membership desk at your local Sam&#39;s Club""","""off___1___Prospective member must bring email with activation code 12502.  Associates should not offer this incentive unsolicited to new members joining.""","""off___2___Member can join either online using the link in the email received or bring the offer to the membership desk in club.""","""off___3___Members who join online must still redeem the actual gift card at the membership desk in the club.""","""off___4___Offer is an Instant Savings on a $45 gift card. This offer works differently than a traditional gift card. FOLLOW INSTRUCTIONS UNDER ADDITIONAL DETAILS BELOW.""","""val___0___NEW members only (not valid for existing membership renewals).""","""add___0___Online Sign-up:""","""add___0___sub___0___Member must join online using the link in the email received for the system to load the offer onto the new membership.""","""add___0___sub___1___On a register&#44; swipe the new membership card and enter item #980299084<ul><li>If you receive a message stating&#44; Remind the member this gift card can only be used for membership&#44; please click OK and ignore the message.</li><li>The $45 Instant Savings discount will be applied when totaled so member pays $0.00 and balance on the gift card will be $45.</li><li>If the Instant Savings discount does not apply&#44; you can use traditional $45 gift card #980256186</li></ul>""","""add___1___In Club Sign-up:""","""add___1___sub___0___Create a new Club membership and enter activation code 12502 listed in the marketing to load Instant Savings to member&#39;s card""","""add___1___sub___1___Process transaction for a new $45.00 membership and take payment.""","""add___1___sub___2___In a second separate transaction&#44; scan member&#39;s new card and enter gift card #980299084 ""","""add___1___sub___3___If you receive a message stating&#44; Remind the member this gift card can only be used for membership&#44; please click OK and ignore the message""","""add___1___sub___4___The $45 Instant Savings will be applied when totaled so member pays $0.00 and balance on gift card will be $45.""","""add___2___Use this opportunity to tell the member about the benefits of Plus and upgrade the member in a separate transaction. """,,,,,,,,,,,,,,,,,,,,,,,,,,,,,,,,,,,,,,,,,,,,
memberPromo,"""Synchrony Spring Membership Drive - FY22""","""4/1/21""","""5/31/21""",,,,,"""off___0___Synchrony employees will receive a company paid membership offer to join or renew membership. Exempt (salaried) members get a partially paid Club membership. Non-Exempt (hourly) members get a fully paid Club membership. The member is responsible for the upgrade fee to Plus.""","""val___0___Offer is only good for Synchrony employees.""","""add___0___This offer is only good when the certificate and a Synchrony email is presented at the membership desk in the club.""","""add___1___Synchrony Financial Exempt (salaried) Employees:""","""add___1___sub___0___Add a valid email address to the account and check for proof of employment.""","""add___1___sub___1___In membership screen&#44; key in activation code - For new Sam&#39;s Club Membership&#44; key in item 12494 and for Sam&#39;s Club membership renewal&#44; key in item 12495""","""add___1___sub___2___Process new or renewing membership at register.""","""add___1___sub___3___On register&#44; Instant Savings will redeem and show membership price of $30.00""","""add___1___sub___4___If member is a new or renewing Plus member&#44; remaining $55 fee will auto prompt.""","""add___2___Synchrony Financial Non-Exempt (hourly) Employees:""","""add___2___sub___0___Add a valid email address to the account and check for proof of employment.""","""add___2___sub___1___In membership screen&#44; key in activation code - For new Sam&#39;s Club Membership&#44; key in item 12496 and for Sam&#39;s Club membership renewal&#44; key in item 12497""","""add___2___sub___2___Process new or renewing membership at register.""","""add___2___sub___3___On register&#44; Instant Savings will redeem and show membership price of $0.00""","""add___2___sub___4___If member is a new or renewing Plus member&#44; remaining $55 fee will auto prompt.""","""res___0___To see an example of the EXEMPT (hourly) certificate&#44; click <a href=\""/content/dam/sams-wire/membership/currentpromotions/2021/Spring_21_Synchrony_Exempt.pdf\"">here</a>.  To see an example of the NON-EXEMPT certificate&#44; click <a href=\""/content/dam/sams-wire/membership/currentpromotions/2021/Spring_21_Synchrony_Non_Exempt.pdf\"">here</a>.""",,,,,,,,,,,,,,,,,,,,,,,,,,,,,,,,,,,,,,,,,,,,
memberPromo,"""$10 Offer for NEW Plus""","""5/18/21""","""6/30/21""","""4109;4704;4707;4709;4718;4724;4728;4730;4731;4732;4735;4736;4738;4739;4740;4741;4745;4749;4755;4761;4767;4768;4770;4775;4776;4777;4778;4780;4786;4787;4789;4790;4791;4799;4802;4804;4805;4808;4815;4816;4817;4819;4822;4824;4825;4829;4830;4836;4837;4839;4840;4851;4853;4870;4871;4873;4874;4875;4876;4878;4908;4915;4920;4926;4930;4933;4942;4947;4955;4962;4963;4969;4973;4974;4983;4985;4987;4989;4990;4992;4999;6181;6205;6213;6219;6220;6228;6235;6238;6240;6242;6247;6249;6251;6252;6254;6256;6257;6260;6261;6267;6275;6304;6307;6308;6309;6310;6311;6312;6320;6321;6324;6325;6326;6328;6329;6331;6334;6339;6342;6344;6345;6349;6350;6358;6360;6361;6373;6375;6377;6378;6379;6380;6382;6384;6385;6388;6405;6407;6409;6410;6412;6413;6415;6418;6424;6425;6426;6427;6430;6432;6433;6435;6436;6437;6444;6449;6450;6454;6455;""","""6457;6461;6464;6472;6474;6479;6485;6487;6489;6501;6503;6505;6507;6509;6510;6512;6514;6517;6518;6521;6527;6528;6535;6549;6556;6565;6568;6572;6604;6605;6606;6608;6609;6610;6612;6613;6614;6615;6616;6617;6619;6620;6621;6622;6624;6626;6628;6630;6631;6632;6633;6634;6635;6643;6644;6646;6657;6659;6660;6662;6664;6666;6667;6682;6683;6684;6685;6686;6692;6779;6979;7189;8102;8104;8106;8107;8111;8112;8114;8117;8119;8123;8125;8128;8132;8133;8134;8135;8136;8139;8146;8147;8149;8152;8158;8162;8163;8164;8165;8166;8167;8168;8169;8172;8174;8176;8177;8180;8181;8182;8183;8184;8185;8188;8194;8196;8197;8203;8205;8207;8208;8209;8211;8213;8215;8221;8222;8224;8225;8236;8237;8238;8239;8241;8243;8247;8251;8254;8256;8257;8261;8263;8266;8271;8272;8273;8276;8285;8287;8289;8292;8293;8294;8295;8296;8297;8298""",,,"""off___0___$10 Gift Card #: 980244029""","""val___0___NEW members only who join as plus (not valid for existing membership renewals).""","""val___0___sub___0___NEW members are defined as a person that has not had an active membership in the past 6 months.""","""val___1___<strong>CONDITIONS</strong>:  This offer cannot be combined with any other offer.  The only exception is if a NEW member is bringing in an acquisition offer they received to join as Club.""","""add___0___<strong>To stack this offer with a Club level acquisition offer&#44; you must process two separate transactions.</strong><ul><li>Complete the new Club member sign up process and follow the offer instructions to issue the acquisition offer.</li><li>Create a new transaction to upgrade the new member to Plus and follow the offer instructions above to issue the upgrade offer.</li><li>New members&#44; who upgrade the same day they join&#44; are counted as Plus First.</li></ul>""","""add___1___<strong>New Member must join as Plus to receive the $10 offer.</strong>""","""add___1___sub___0___Explain the benefits of Plus:  Early Shopping Hours&#44; Free Shipping and Cash Rewards (2% with Plus)""","""add___2___<strong>$30 Statement Credit on new Sam&#39;s Club Credit Card</strong>""","""add___2___sub___0___<strong>Explain to the member about the benefits they could receive if they are approved for the Sam&#39;s Club Credit Card.</strong><ul><li>Ask the member if they would like to apply for a Sam&#39;s Club credit card. Members get a $30 credit statement credit when they open a Sam&#39;s Club credit card account and cardholder makes $30 in Sam&#39;s Club purchases in the first 30 days&#44; using their new Sam&#39;s Club Credit Card and/or Sam&#39;s Club Mastercard.</li><li>Associates should hand the App brochure to the member and should avoid speaking about this in connection with a membership offer.</li></ul>""","""add___2___sub___1___<strong>Tell the member about the exciting features of the Sam&#39;s Club App</strong><ul><li>Digital membership card&#44; skip the checkout lanes with Scan and Go&#44; Request Rx refills</li></ul>""","""res___0___Membership selling resources are available on the membership page on the WIRE at:  Club Area Pages > Membership and Services.""","""url_text___Membership and Services""","""url___https://one.walmart.com/content/sams_wire/en_us/work/club_hub/member-services/membership.html""",,,,,,,,,,,,,,,,,,,,,,,,,,,,,,,,,,,,,,,,,,,,,,,
memberPromo,"""$25 Offer for NEW Plus""","""5/18/21""","""6/30/21""","""4781;4944;4982;6313;6315;6319;6359;6417;6419;6429;6562;6658;6661;6663;8291""",,,,"""off___0___$25 instant savings gift card""","""off___0___sub___0___Activation Code: 12504""","""off___0___sub___1___Gift card number: 980244023""","""val___0___NEW members only who join as plus (not valid for existing membership renewals).""","""val___0___sub___0___NEW members are defined as a person that has not had an active membership in the past 6 months.""","""val___1___<strong>CONDITIONS</strong>:  This offer cannot be combined with any other offer.  The only exception is if a NEW member is bringing in an acquisition offer they received to join as Club.""","""add___0___<strong>To stack this offer with a Club level acquisition offer&#44; you must process two separate transactions.</strong><ul><li>Complete the new Club member sign up process and follow the offer instructions to issue the acquisition offer.</li><li>Create a new transaction to upgrade the new member to Plus and follow the offer instructions above to issue the upgrade offer.</li><li>New members&#44; who upgrade the same day they join&#44; are counted as Plus First.</li></ul>""","""add___1___<strong>New Member must join as Plus to receive the $25 offer.</strong>""","""add___1___sub___0___Explain the benefits of Plus:  Early Shopping Hours&#44; Free Shipping and Cash Rewards (2% with Plus and 3% with Sam&39;s Club Mastercard)""","""add___2___<strong>$30 Statement Credit on new Sam&#39;s Club Credit Card</strong>""","""add___2___sub___0___<strong>Explain to the member about the benefits they could receive if they are approved for the Sam&#39;s Club Credit Card.</strong><ul><li>Ask the member if they would like to apply for a Sam&#39;s Club credit card. Members get a $30 credit statement credit when they open a Sam&#39;s Club credit card account and cardholder makes $30 in Sam&#39;s Club purchases in the first 30 days&#44; using their new Sam&#39;s Club Credit Card and/or Sam&#39;s Club Mastercard.</li><li>Associates should hand the App brochure to the member and should avoid speaking about this in connection with a membership offer.</li></ul>""","""add___2___sub___1___<strong>Tell the member about the exciting features of the Sam&#39;s Club App</strong><ul><li>Digital membership card&#44; skip the checkout lanes with Scan and Go&#44; Request Rx refills</li></ul>""","""res___0___Membership selling resources are available on the membership page on the WIRE at:  Club Area Pages > Membership and Services.""","""url_text___Membership and Services""","""url___https://one.walmart.com/content/sams_wire/en_us/work/club_hub/member-services/membership.html""",,,,,,,,,,,,,,,,,,,,,,,,,,,,,,,,,,,,,,,,,,,,,
memberPromo,"""Plus Challenge""","""5/13/21""","""5/16/21""",,,,,"""off___0___Plus Upgrade $10 Gift Card Item #: 980256180""","""res___0___Membership selling resources are available on the membership page on the WIRE at:  Club Area Pages > Membership and Services""","""url_text___Membership and Services""","""url___https://one.walmart.com/content/sams_wire/en_us/work/club_hub/member-services/membership.html""",,,,,,,,,,,,,,,,,,,,,,,,,,,,,,,,,,,,,,,,,,,,,,,,,,,,,,,,
memberPromo,"""Plus Challenge""","""5/28/21""","""5/31/21""",,,,,"""off___0___Plus Upgrade $10 Gift Card Item #: 980256181""","""res___0___Membership selling resources are available on the membership page on the WIRE at:  Club Area Pages > Membership and Services""","""url_text___Membership and Services""","""url___https://one.walmart.com/content/sams_wire/en_us/work/club_hub/member-services/membership.html""",,,,,,,,,,,,,,,,,,,,,,,,,,,,,,,,,,,,,,,,,,,,,,,,,,,,,,,,
